<?xml version="1.0" encoding="UTF-8"?>
<xs:schema xmlns:xs="http://www.w3.org/2001/XMLSchema" elementFormDefault="qualified" attributeFormDefault="unqualified">
	<xs:element name="Articles">
		<xs:complexType>
			<xs:sequence>
				<xs:element name="Article" type="ArticleType" maxOccurs="unbounded"/>
			</xs:sequence>
		</xs:complexType>
	</xs:element>
	<xs:complexType name="ArticleType">
		<xs:sequence>
			<xs:element name="Number" type="xs:integer" minOccurs="0"/>
			<xs:element name="Name" type="xs:string" minOccurs="0"/>
			<xs:element name="SinglePrice" type="xs:decimal" minOccurs="0"/>
			<xs:element name="Description" type="xs:string" minOccurs="0"/>
		</xs:sequence>
	</xs:complexType>
</xs:schema>